,channelTitle,title,publishedAt,viewCount,likeCount,commentCount,month,duration_by_secs,title_new
3036,TED,jonathan trent  energy from floating algae pods,28/09/2012,196013,3609,280,Sep,886,"['jonathan', 'trent', 'energy', 'floating', 'algae', 'pods']"
3037,TED,bahia shehab  a thousand times no,28/09/2012,83347,1391,177,Sep,357,"['bahia', 'shehab', 'thousand', 'times']"
3038,TED,kent larson  brilliant designs to fit more people in every city,27/09/2012,192771,3721,417,Sep,1002,"['kent', 'larson', 'brilliant', 'designs', 'fit', 'people', 'every', 'city']"
3039,TED,beth noveck  demand a more open source government,27/09/2012,27099,478,103,Sep,1044,"['beth', 'noveck', 'demand', 'open', 'source', 'government']"
3040,TED,what doctors don t know about the drugs they prescribe   ben goldacre,27/09/2012,684359,10436,1040,Sep,810,"['doctors', 'know', 'drugs', 'prescribe', 'ben', 'goldacre']"
3041,TED,clay shirky  how the internet will  one day  transform government,25/09/2012,142342,3317,269,Sep,1113,"['clay', 'shirky', 'internet', 'one', 'day', 'transform', 'government']"
3042,TED,andrew mcafee  are droids taking our jobs ,24/09/2012,159489,2547,916,Sep,848,"['andrew', 'mcafee', 'droids', 'taking', 'jobs']"
3043,TED,read montague  what we re learning from 5 000 brains,24/09/2012,44913,532,69,Sep,804,"['read', 'montague', 'learning', '5', '000', 'brains']"
3044,TED,rachel botsman  the currency of the new economy is trust,24/09/2012,144650,1753,165,Sep,1187,"['rachel', 'botsman', 'currency', 'economy', 'trust']"
3045,TED,ed gavagan  a story about knots and surgeons,24/09/2012,132248,2695,172,Sep,742,"['gavagan', 'story', 'knots', 'surgeons']"
3046,TED,bandi mbubi  demand a fair trade cell phone,24/09/2012,27128,468,53,Sep,562,"['bandi', 'mbubi', 'demand', 'fair', 'trade', 'cell', 'phone']"
3047,TED,andrew blum  what is the internet  really ,19/09/2012,407381,5911,376,Sep,720,"['andrew', 'blum', 'internet', 'really']"
3048,TED,julian treasure  why architects need to use their ears,18/09/2012,167201,3137,150,Sep,592,"['julian', 'treasure', 'architects', 'ears']"
3049,TED,sarah jayne blakemore  the mysterious workings of the adolescent brain,17/09/2012,729694,5588,235,Sep,867,"['sarah', 'jayne', 'blakemore', 'mysterious', 'workings', 'adolescent', 'brain']"
3050,TED,tristram stuart  the global food waste scandal,17/09/2012,288736,4064,210,Sep,856,"['tristram', 'stuart', 'global', 'food', 'waste', 'scandal']"
3051,TED,a choreographer s creative process in real time   wayne mcgregor   ted talks,14/09/2012,393723,6914,384,Sep,919,"['choreographer', 'creative', 'process', 'real', 'time', 'wayne', 'mcgregor', 'talks']"
3052,TED,susan solomon  the promise of research with stem cells,13/09/2012,91093,1155,193,Sep,899,"['susan', 'solomon', 'promise', 'research', 'stem', 'cells']"
3053,TED,leslie t  chang  the voices of china s workers,12/09/2012,214756,3125,482,Sep,866,"['leslie', 'chang', 'voices', 'china', 'workers']"
3054,TED,mental health for all by involving all   vikram patel   ted talks,11/09/2012,264974,2629,194,Sep,743,"['mental', 'health', 'involving', 'vikram', 'patel', 'talks']"
3055,TED,scott fraser  the problem with eyewitness testimony,10/09/2012,202836,2319,297,Sep,1251,"['scott', 'fraser', 'problem', 'eyewitness', 'testimony']"
3056,TED,antony gormley  sculpted space  within and without,07/09/2012,87440,1348,106,Sep,957,"['antony', 'gormley', 'sculpted', 'space', 'within', 'without']"
3057,TED,shyam sankar  the rise of human computer cooperation,06/09/2012,60420,1056,129,Sep,733,"['shyam', 'sankar', 'rise', 'human', 'computer', 'cooperation']"
3058,TED,robert neuwirth  the power of the informal economy,05/09/2012,97091,1311,120,Sep,750,"['robert', 'neuwirth', 'power', 'informal', 'economy']"
3059,TED,before i die i want to      candy chang,04/09/2012,671654,9066,800,Sep,381,"['die', 'want', 'candy', 'chang']"
3060,TED,rob legato  the art of creating awe,17/08/2012,245929,3403,179,Aug,988,"['rob', 'legato', 'art', 'creating', 'awe']"
3061,TED,timothy prestero  design for people  not awards,16/08/2012,85748,1666,116,Aug,666,"['timothy', 'prestero', 'design', 'people', 'awards']"
3062,TED,strange answers to the psychopath test   jon ronson,15/08/2012,23759818,461798,23810,Aug,1082,"['strange', 'answers', 'psychopath', 'test', 'jon', 'ronson']"
3063,TED,caitria and morgan o neill  how to step up in the face of disaster,14/08/2012,48450,560,56,Aug,564,"['caitria', 'morgan', 'neill', 'step', 'face', 'disaster']"
3064,TED,ivan krastev  can democracy exist without trust ,13/08/2012,53746,1153,135,Aug,845,"['ivan', 'krastev', 'democracy', 'exist', 'without', 'trust']"
3065,TED,creativity is a remix   kirby ferguson,10/08/2012,407924,8005,385,Aug,583,"['creativity', 'remix', 'kirby', 'ferguson']"
3066,TED,how we can eat our landscapes   pam warhurst,09/08/2012,189670,2815,185,Aug,802,"['eat', 'landscapes', 'pam', 'warhurst']"
3067,TED,max little  a test for parkinson s with a phone call,07/08/2012,111401,1057,76,Aug,365,"['max', 'little', 'test', 'parkinson', 'phone', 'call']"
3068,TED,dare to disagree   margaret heffernan,06/08/2012,510288,5556,256,Aug,776,"['dare', 'disagree', 'margaret', 'heffernan']"
3069,TED,fighting with non violence   scilla elworthy,05/08/2012,261871,2903,441,Aug,948,"['fighting', 'non', 'violence', 'scilla', 'elworthy']"
3070,TED,the mad scientist of music   mark applebaum,03/08/2012,4695493,54797,6072,Aug,1011,"['mad', 'scientist', 'music', 'mark', 'applebaum']"
3071,TED,becci manson   re touching lives through photos,02/08/2012,73692,1386,80,Aug,590,"['becci', 'manson', 'touching', 'lives', 'photos']"
3072,TED,daphne koller  what we re learning from online education,01/08/2012,648266,9047,641,Aug,1241,"['daphne', 'koller', 'learning', 'online', 'education']"
3073,TED,stephen ritz  a teacher growing green in the south bronx,31/07/2012,134263,2559,205,Jul,823,"['stephen', 'ritz', 'teacher', 'growing', 'green', 'south', 'bronx']"
3074,TED,michael anti  behind the great firewall of china,30/07/2012,323432,5499,1399,Jul,1132,"['michael', 'anti', 'behind', 'great', 'firewall', 'china']"
3075,TED,michael hansmeyer  building unimaginable shapes,27/07/2012,177802,3369,308,Jul,668,"['michael', 'hansmeyer', 'building', 'unimaginable', 'shapes']"
3076,TED,imaging at a trillion frames per second   ramesh raskar,26/07/2012,3187082,53470,3296,Jul,662,"['imaging', 'trillion', 'frames', 'per', 'second', 'ramesh', 'raskar']"
3077,TED,tracy chevalier  finding the story inside the painting,25/07/2012,242578,2763,236,Jul,862,"['tracy', 'chevalier', 'finding', 'story', 'inside', 'painting']"
3078,TED,malte spitz  your phone company is watching,24/07/2012,140174,2267,302,Jul,597,"['malte', 'spitz', 'phone', 'company', 'watching']"
3079,TED,james stavridis  how nato s supreme commander thinks about global security,23/07/2012,55159,806,327,Jul,1004,"['james', 'stavridis', 'nato', 'supreme', 'commander', 'thinks', 'global', 'security']"
3080,TED,neil harbisson  i listen to color,20/07/2012,773515,14213,942,Jul,576,"['neil', 'harbisson', 'listen', 'color']"
3081,TED,matt mills  image recognition that triggers augmented reality,19/07/2012,232169,2082,197,Jul,485,"['matt', 'mills', 'image', 'recognition', 'triggers', 'augmented', 'reality']"
3082,TED,baba shiv  sometimes it s good to give up the driver s seat,18/07/2012,42965,463,77,Jul,588,"['baba', 'shiv', 'sometimes', 'good', 'give', 'driver', 'seat']"
3083,TED,jamie drummond  let s crowd source the world s goals,17/07/2012,62876,619,109,Jul,731,"['jamie', 'drummond', 'let', 'crowd', 'source', 'world', 'goals']"
3084,TED,mina bissell  experiments that point to a new understanding of cancer,16/07/2012,97613,1900,170,Jul,979,"['mina', 'bissell', 'experiments', 'point', 'understanding', 'cancer']"
3085,TED,jared ficklin  new ways to see music  with color  and fire  ,13/07/2012,41153,804,111,Jul,601,"['jared', 'ficklin', 'ways', 'see', 'music', 'color', 'fire']"
3086,TED,marc goodman  a vision of crimes in the future,12/07/2012,210283,2589,899,Jul,1166,"['marc', 'goodman', 'vision', 'crimes', 'future']"
3087,TED,chris gerdes  the future race car    150mph  and no driver,11/07/2012,62597,832,120,Jul,648,"['chris', 'gerdes', 'future', 'race', 'car', '150mph', 'driver']"
3088,TED,the game that can give you 10 extra years of life   jane mcgonigal,09/07/2012,1096922,18160,1307,Jul,1171,"['game', 'give', '10', 'extra', 'years', 'life', 'jane', 'mcgonigal']"
3089,TED,what s your 200 year plan    raghava kk,06/07/2012,39243,553,128,Jul,659,"['200', 'year', 'plan', 'raghava', 'kk']"
3090,TED,a young guitarist meets his hero   usman riaz and preston reed,06/07/2012,3386064,46593,1398,Jul,1003,"['young', 'guitarist', 'meets', 'hero', 'usman', 'riaz', 'preston', 'reed']"
3091,TED,cesar harada  a novel idea for cleaning up oil spills,05/07/2012,68347,1465,157,Jul,871,"['cesar', 'harada', 'novel', 'idea', 'cleaning', 'oil', 'spills']"
3092,TED,alanna shaikh  how i m preparing to get alzheimer s,03/07/2012,115079,1806,262,Jul,387,"['alanna', 'shaikh', 'preparing', 'get', 'alzheimer']"
3093,TED,boaz almog  levitates  a superconductor,02/07/2012,733627,10782,1083,Jul,626,"['boaz', 'almog', 'levitates', 'superconductor']"
3094,TED,a tale of mental illness   elyn saks,02/07/2012,1127276,16916,930,Jul,893,"['tale', 'mental', 'illness', 'elyn', 'saks']"
3095,TED,don tapscott  four principles for the open world,28/06/2012,114459,2195,200,Jun,1071,"['tapscott', 'four', 'principles', 'open', 'world']"
3096,TED,how arduino is open sourcing imagination   massimo banzi,27/06/2012,739888,7811,264,Jun,947,"['arduino', 'open', 'sourcing', 'imagination', 'massimo', 'banzi']"
3097,TED,rives  reinventing the encyclopedia game,27/06/2012,62477,1502,134,Jun,647,"['rives', 'reinventing', 'encyclopedia', 'game']"
3098,TED,e o  wilson  advice to young scientists,25/06/2012,241407,6462,641,Jun,897,"['wilson', 'advice', 'young', 'scientists']"
3099,TED,wolfgang kessling  how to air condition outdoor spaces,22/06/2012,44735,567,134,Jun,696,"['wolfgang', 'kessling', 'air', 'condition', 'outdoor', 'spaces']"
3100,TED,marco tempest  the electric rise and fall of nikola tesla,20/06/2012,337464,4672,316,Jun,366,"['marco', 'tempest', 'electric', 'rise', 'fall', 'nikola', 'tesla']"
3101,TED,ivan oransky  are we over medicalized ,19/06/2012,49904,662,105,Jun,625,"['ivan', 'oransky', 'medicalized']"
3102,TED,peter norvig  the 100 000 student classroom,18/06/2012,93543,1215,76,Jun,372,"['peter', 'norvig', '100', '000', 'student', 'classroom']"
3103,TED,lessons from death row inmates   david r  dow,18/06/2012,2758385,38996,2925,Jun,1097,"['lessons', 'death', 'row', 'inmates', 'david']"
3104,TED,lz granderson  the myth of the gay agenda   ted,15/06/2012,275766,6415,2368,Jun,1072,"['lz', 'granderson', 'myth', 'gay', 'agenda']"
3105,TED,archeology from space   sarah parcak,14/06/2012,103152,1189,176,Jun,321,"['archeology', 'space', 'sarah', 'parcak']"
3106,TED,beeban kidron  the shared wonder of film,13/06/2012,46731,920,90,Jun,793,"['beeban', 'kidron', 'shared', 'wonder', 'film']"
3107,TED,rebecca onie  what if our healthcare system kept us healthy ,12/06/2012,140234,1566,413,Jun,995,"['rebecca', 'onie', 'healthcare', 'system', 'kept', 'healthy']"
3108,TED,john hockenberry  we are all designers,12/06/2012,52612,1042,89,Jun,1184,"['john', 'hockenberry', 'designers']"
3109,TED,john hodgman  design  explained ,08/06/2012,93921,1189,208,Jun,384,"['john', 'hodgman', 'design', 'explained']"
3110,TED,damian palin  mining minerals from seawater,07/06/2012,55710,1272,145,Jun,182,"['damian', 'palin', 'mining', 'minerals', 'seawater']"
3111,TED,why is  x  the unknown    terry moore,06/06/2012,679233,12356,866,Jun,238,"['unknown', 'terry', 'moore']"
3112,TED,what we didn t know about male anatomy   diane kelly,05/06/2012,1212600,4799,626,Jun,681,"['know', 'male', 'anatomy', 'diane', 'kelly']"
3113,TED,juan enriquez  will our kids be a different species ,04/06/2012,200001,4658,638,Jun,1009,"['juan', 'enriquez', 'kids', 'different', 'species']"
3114,TED,dancing with light   quixotic fusion,01/06/2012,388113,2651,222,Jun,743,"['dancing', 'light', 'quixotic', 'fusion']"
3115,TED,sebastian deterding  what your designs say about you,31/05/2012,32012,431,83,May,744,"['sebastian', 'deterding', 'designs', 'say']"
3116,TED,dalia mogahed  the attitudes that sparked arab spring,30/05/2012,87370,1441,276,May,873,"['dalia', 'mogahed', 'attitudes', 'sparked', 'arab', 'spring']"
3117,TED,william noel  revealing the lost codex of archimedes,29/05/2012,108996,2897,294,May,894,"['william', 'noel', 'revealing', 'lost', 'codex', 'archimedes']"
3118,TED,reggie watts disorients you in the most entertaining way,25/05/2012,10203627,154252,11005,May,584,"['reggie', 'watts', 'disorients', 'entertaining']"
3119,TED,shereen el feki  how to fight an epidemic of bad laws,24/05/2012,43060,620,231,May,929,"['shereen', 'feki', 'fight', 'epidemic', 'bad', 'laws']"
3120,TED,philippe petit  the journey across the high wire,23/05/2012,141895,2764,168,May,1148,"['philippe', 'petit', 'journey', 'across', 'high', 'wire']"
3121,TED,religions and babies   hans rosling,22/05/2012,1610065,33911,2328,May,801,"['religions', 'babies', 'hans', 'rosling']"
3122,TED,nathan wolfe  what s left to explore ,21/05/2012,44042,846,110,May,431,"['nathan', 'wolfe', 'left', 'explore']"
3123,TED,one year of turning the world inside out   jr,18/05/2012,196485,1098,251,May,392,"['one', 'year', 'turning', 'world', 'inside', 'jr']"
3124,TED,carl schoonover  how to look inside the brain,17/05/2012,72198,886,157,May,300,"['carl', 'schoonover', 'look', 'inside', 'brain']"
3125,TED,how to build your creative confidence   david kelley,16/05/2012,2188649,29182,747,May,707,"['build', 'creative', 'confidence', 'david', 'kelley']"
3126,TED,jean baptiste michel  the mathematics of history,15/05/2012,91205,1011,129,May,267,"['jean', 'baptiste', 'michel', 'mathematics', 'history']"
3127,TED,the optimism bias   tali sharot,14/05/2012,524439,6047,393,May,1061,"['optimism', 'bias', 'tali', 'sharot']"
3128,TED,renny gleeson  404  the story of a page not found,11/05/2012,200021,2173,184,May,248,"['renny', 'gleeson', '404', 'story', 'page', 'found']"
3129,TED,feats of memory anyone can do   joshua foer,10/05/2012,1645376,29656,977,May,1229,"['feats', 'memory', 'anyone', 'joshua', 'foer']"
3130,TED,karen bass  unseen footage  untamed nature,09/05/2012,93457,1355,124,May,629,"['karen', 'bass', 'unseen', 'footage', 'untamed', 'nature']"
3131,TED,jp rangaswami  information is food,08/05/2012,66882,1058,98,May,489,"['jp', 'rangaswami', 'information', 'food']"
3132,TED,michael tilson thomas  music and emotion through time,07/05/2012,633703,10155,522,May,1214,"['michael', 'tilson', 'thomas', 'music', 'emotion', 'time']"
3133,TED,rory sutherland  perspective is everything,04/05/2012,1027071,18680,469,May,1105,"['rory', 'sutherland', 'perspective', 'everything']"
3134,TED,gary kovacs  tracking the trackers,03/05/2012,170064,2338,236,May,400,"['gary', 'kovacs', 'tracking', 'trackers']"
3135,TED,reuben margolin  sculpting waves in wood and time,02/05/2012,45172,917,87,May,539,"['reuben', 'margolin', 'sculpting', 'waves', 'wood', 'time']"
3136,TED,amory lovins  a 40 year plan for energy,01/05/2012,138734,2315,312,May,1625,"['amory', 'lovins', '40', 'year', 'plan', 'energy']"
3137,TED,liz diller  a giant bubble for debate,30/04/2012,39973,354,190,Apr,727,"['liz', 'diller', 'giant', 'bubble', 'debate']"
3138,TED,eduardo paes  the 4 commandments of cities,26/04/2012,64584,707,169,Apr,742,"['eduardo', 'paes', '4', 'commandments', 'cities']"
3139,TED,the surprising science of happiness   dan gilbert,26/04/2012,4004323,38217,1441,Apr,1280,"['surprising', 'science', 'happiness', 'dan', 'gilbert']"
3140,TED,our buggy moral code   dan ariely,26/04/2012,254185,3508,159,Apr,981,"['buggy', 'moral', 'code', 'dan', 'ariely']"
3141,TED,how to buy happiness   michael norton,24/04/2012,671461,6037,407,Apr,659,"['buy', 'happiness', 'michael', 'norton']"
3142,TED,why is our universe fine tuned for life    brian greene,23/04/2012,4530857,63256,12461,Apr,1308,"['universe', 'fine', 'tuned', 'life', 'brian', 'greene']"
3143,TED,christina warinner  tracking ancient diseases using     plaque,20/04/2012,43265,568,44,Apr,332,"['christina', 'warinner', 'tracking', 'ancient', 'diseases', 'using', 'plaque']"
3144,TED,laura carstensen  older people are happier,19/04/2012,107037,860,207,Apr,699,"['laura', 'carstensen', 'older', 'people', 'happier']"
3145,TED,taryn simon  the stories behind the bloodlines,18/04/2012,50522,574,124,Apr,1080,"['taryn', 'simon', 'stories', 'behind', 'bloodlines']"
3146,TED,drew curtis  how i beat a patent troll,17/04/2012,145457,3180,305,Apr,401,"['drew', 'curtis', 'beat', 'patent', 'troll']"
3147,TED,how do we heal medicine    atul gawande,16/04/2012,416655,4684,197,Apr,1160,"['heal', 'medicine', 'atul', 'gawande']"
3148,TED,abigail washburn  building us china relations     by banjo,13/04/2012,114149,1489,142,Apr,395,"['abigail', 'washburn', 'building', 'china', 'relations', 'banjo']"
3149,TED,tal golesworthy  how i repaired my own heart,12/04/2012,93850,1524,152,Apr,795,"['golesworthy', 'repaired', 'heart']"
3150,TED,let s put birth control back on the agenda   melinda gates,11/04/2012,242673,3412,2300,Apr,1528,"['let', 'put', 'birth', 'control', 'back', 'agenda', 'melinda', 'gates']"
3151,TED,moral behavior in animals   frans de waal,10/04/2012,1834924,30040,1689,Apr,1013,"['moral', 'behavior', 'animals', 'frans', 'waal']"
3152,TED,half a million secrets   frank warren,09/04/2012,678194,6817,248,Apr,685,"['half', 'million', 'secrets', 'frank', 'warren']"
3153,TED,lucy mcrae  how can technology transform the human body ,06/04/2012,135329,1335,381,Apr,240,"['lucy', 'mcrae', 'technology', 'transform', 'human', 'body']"
3154,TED,jack choi  on the virtual dissection table,05/04/2012,90113,856,169,Apr,397,"['jack', 'choi', 'virtual', 'dissection', 'table']"
3155,TED,the hilarious art of book design   chip kidd,04/04/2012,959314,28864,1078,Apr,1037,"['hilarious', 'art', 'book', 'design', 'chip', 'kidd']"
3156,TED,connected  but alone    sherry turkle,03/04/2012,1761245,27317,2968,Apr,1189,"['connected', 'alone', 'sherry', 'turkle']"
3157,TED,a taste of ted2012,31/03/2012,109854,922,84,Mar,241,"['taste', 'ted2012']"
3158,TED,marco tempest  a magical tale  with augmented reality ,30/03/2012,213258,2396,156,Mar,392,"['marco', 'tempest', 'magical', 'tale', 'augmented', 'reality']"
3159,TED,ayah bdeir  building blocks that blink  beep and teach,29/03/2012,198296,2303,181,Mar,328,"['ayah', 'bdeir', 'building', 'blocks', 'blink', 'beep', 'teach']"
3160,TED,leymah gbowee  unlock the intelligence  passion  greatness of girls   ted,28/03/2012,189328,2746,284,Mar,880,"['leymah', 'gbowee', 'unlock', 'intelligence', 'passion', 'greatness', 'girls']"
3161,TED,regina dugan  from mach 20 glider to hummingbird drone,27/03/2012,192820,2213,468,Mar,1502,"['regina', 'dugan', 'mach', '20', 'glider', 'hummingbird', 'drone']"
3162,TED,donald sadoway  the missing link to renewable energy,26/03/2012,761720,12315,1506,Mar,916,"['donald', 'sadoway', 'missing', 'link', 'renewable', 'energy']"
3163,TED,billy collins  everyday moments  caught in time,23/03/2012,294568,3228,158,Mar,914,"['billy', 'collins', 'everyday', 'moments', 'caught', 'time']"
3164,TED,yup  i built a nuclear fusion reactor   taylor wilson,22/03/2012,706791,6586,1834,Mar,213,"['yup', 'built', 'nuclear', 'fusion', 'reactor', 'taylor', 'wilson']"
3165,TED,andrew stanton  the clues to a great story,21/03/2012,2613846,67059,1318,Mar,1157,"['andrew', 'stanton', 'clues', 'great', 'story']"
3166,TED,noel bairey merz  the single biggest health threat women face,21/03/2012,60390,505,203,Mar,960,"['noel', 'bairey', 'merz', 'single', 'biggest', 'health', 'threat', 'women', 'face']"
3167,TED,t  boone pickens  let s transform energy    with natural gas,19/03/2012,97116,995,398,Mar,1183,"['boone', 'pickens', 'let', 'transform', 'energy', 'natural', 'gas']"
3168,TED,listening to shame   brené brown,16/03/2012,6480000,101586,1969,Mar,1239,"['listening', 'shame', 'brené', 'brown']"
3169,TED,the $8 billion ipod   rob reid,15/03/2012,943619,16605,827,Mar,312,"['$8', 'billion', 'ipod', 'rob', 'reid']"
3170,TED,jonathan haidt  religion  evolution  and the ecstasy of self transcendence,14/03/2012,323110,5950,899,Mar,1097,"['jonathan', 'haidt', 'religion', 'evolution', 'ecstasy', 'transcendence']"
3171,TED,a ted speaker s worst nightmare   colin robertson,09/03/2012,951858,8030,1214,Mar,230,"['speaker', 'worst', 'nightmare', 'colin', 'robertson']"
3172,TED,jennifer pahlka  coding a better government,08/03/2012,94125,1553,330,Mar,732,"['jennifer', 'pahlka', 'coding', 'better', 'government']"
3173,TED,james hansen  why i must speak out about climate change,07/03/2012,328575,4460,3019,Mar,1072,"['james', 'hansen', 'speak', 'climate', 'change']"
3174,TED,bryan stevenson  we need to talk about an injustice   ted,05/03/2012,1674914,34317,1563,Mar,1422,"['bryan', 'stevenson', 'injustice']"
3175,TED,the power of introverts   susan cain,02/03/2012,14972424,386091,18810,Mar,1145,"['power', 'introverts', 'susan', 'cain']"
3176,TED,robots that fly     and cooperate   vijay kumar,01/03/2012,2156594,18305,1236,Mar,1007,"['robots', 'fly', 'cooperate', 'vijay', 'kumar']"
3177,TED,paul gilding  the earth is full,01/03/2012,339721,3597,1572,Mar,1007,"['paul', 'gilding', 'earth', 'full']"
3178,TED,abundance is our future   peter diamandis,01/03/2012,478928,7537,973,Mar,975,"['abundance', 'future', 'peter', 'diamandis']"
3179,TED,paul snelgrove  a census of the ocean,28/02/2012,38994,560,49,Feb,1008,"['paul', 'snelgrove', 'census', 'ocean']"
3180,TED,why videos go viral   kevin allocca,27/02/2012,810686,7821,504,Feb,441,"['videos', 'go', 'viral', 'kevin', 'allocca']"
3181,TED,tan le  my immigration story,24/02/2012,345347,3517,402,Feb,737,"['tan', 'immigration', 'story']"
3182,TED,shlomo benartzi  saving for tomorrow  tomorrow,23/02/2012,223373,1943,189,Feb,1066,"['shlomo', 'benartzi', 'saving', 'tomorrow', 'tomorrow']"
3183,TED,shilo shiv suleman  using tech to enable dreaming,22/02/2012,52278,822,237,Feb,457,"['shilo', 'shiv', 'suleman', 'using', 'tech', 'enable', 'dreaming']"
3184,TED,chris bliss  comedy is translation,21/02/2012,60219,1088,150,Feb,961,"['chris', 'bliss', 'comedy', 'translation']"
3185,TED,neil macgregor  2600 years of history in one object,20/02/2012,198458,2590,343,Feb,1178,"['neil', 'macgregor', '2600', 'years', 'history', 'one', 'object']"
3186,TED,paul conneally  digital humanitarianism,17/02/2012,45365,390,28,Feb,658,"['paul', 'conneally', 'digital', 'humanitarianism']"
3187,TED,how do you save a shark you know nothing about    simon berrow,16/02/2012,47485,445,75,Feb,1007,"['save', 'shark', 'know', 'nothing', 'simon', 'berrow']"
3188,TED,lucien engelen  crowdsource your health,15/02/2012,24291,266,33,Feb,373,"['lucien', 'engelen', 'crowdsource', 'health']"
3189,TED,what you don t know about marriage   jenna mccarthy,14/02/2012,3655935,36156,5201,Feb,678,"['know', 'marriage', 'jenna', 'mccarthy']"
3190,TED,tyrone hayes + penelope jagessar chaffer  the toxic baby ,13/02/2012,107773,1407,180,Feb,1069,"['tyrone', 'hayes', '+', 'penelope', 'jagessar', 'chaffer', 'toxic', 'baby']"
3191,TED,impossible photography   erik johansson,10/02/2012,1944597,17552,691,Feb,382,"['impossible', 'photography', 'erik', 'johansson']"
3192,TED,jack horner  shape shifting dinosaurs,09/02/2012,1647830,28271,3104,Feb,1104,"['jack', 'horner', 'shape', 'shifting', 'dinosaurs']"
3193,TED,sheikha al mayassa  globalizing the local  localizing the global,08/02/2012,335613,3545,576,Feb,654,"['sheikha', 'mayassa', 'globalizing', 'local', 'localizing', 'global']"
3194,TED,the moral dangers of non lethal weapons   stephen coleman,07/02/2012,51505,889,206,Feb,1053,"['moral', 'dangers', 'non', 'lethal', 'weapons', 'stephen', 'coleman']"
3195,TED,neil burgess  how your brain tells you where you are,06/02/2012,115563,1379,116,Feb,544,"['neil', 'burgess', 'brain', 'tells']"
3196,TED,danny hillis  back to the future  of 1994 ,03/02/2012,79641,1228,195,Feb,1151,"['danny', 'hillis', 'back', 'future', '1994']"
3197,TED,erica frenkel  the universal anesthesia machine,02/02/2012,58214,797,111,Feb,684,"['erica', 'frenkel', 'universal', 'anesthesia', 'machine']"
3198,TED,the happy secret to better work   shawn achor,01/02/2012,3896477,51242,997,Feb,741,"['happy', 'secret', 'better', 'work', 'shawn', 'achor']"
3199,TED,bill doyle  treating cancer with electric fields,31/01/2012,174902,2095,312,Jan,936,"['bill', 'doyle', 'treating', 'cancer', 'electric', 'fields']"
3200,TED,peter van uhm  why i chose a gun,30/01/2012,3671343,115990,16109,Jan,1031,"['peter', 'van', 'uhm', 'chose', 'gun']"
3201,TED,gayle tzemach lemmon  women entrepreneurs  example not exception,27/01/2012,79757,838,271,Jan,797,"['gayle', 'tzemach', 'lemmon', 'women', 'entrepreneurs', 'example', 'exception']"
3202,TED,ariel garten  know thyself  with a brain scanner,26/01/2012,63281,592,259,Jan,905,"['ariel', 'garten', 'know', 'thyself', 'brain', 'scanner']"
3203,TED,brian goldman  doctors make mistakes  can we talk about that ,25/01/2012,356634,6546,415,Jan,1169,"['brian', 'goldman', 'doctors', 'mistakes']"
3204,TED,diana nyad  extreme swimming with the world s most dangerous jellyfish,24/01/2012,97210,1317,168,Jan,1018,"['diana', 'nyad', 'extreme', 'swimming', 'world', 'dangerous', 'jellyfish']"
3205,TED,lisa harouni  a primer on 3d printing,23/01/2012,230259,2101,468,Jan,890,"['lisa', 'harouni', 'primer', '3d', 'printing']"
3206,TED,sheena iyengar  how to make choosing easier,19/01/2012,502579,3641,193,Jan,966,"['sheena', 'iyengar', 'choosing', 'easier']"
