,channelTitle,title,publishedAt,viewCount,likeCount,commentCount,month,duration_by_secs,title_new
1936,TED,why women should tell the stories of humanity   jude kelly,30/03/2017,65212,1360,668,Mar,803,"['women', 'tell', 'stories', 'humanity', 'jude', 'kelly']"
1937,TED,how i m fighting bias in algorithms   joy buolamwini,29/03/2017,230252,4195,649,Mar,525,"['fighting', 'bias', 'algorithms', 'joy', 'buolamwini']"
1938,TED,to raise brave girls  encourage adventure   caroline paul,28/03/2017,154393,5118,309,Mar,762,"['raise', 'brave', 'girls', 'encourage', 'adventure', 'caroline', 'paul']"
1939,TED,a scientific approach to the paranormal   carrie poppy,27/03/2017,815269,20334,3424,Mar,779,"['scientific', 'approach', 'paranormal', 'carrie', 'poppy']"
1940,TED, rollercoaster    sara ramirez,27/03/2017,343768,5968,225,Mar,300,"['rollercoaster', 'sara', 'ramirez']"
1941,TED,stories from a home for terminally ill children   kathy hull,24/03/2017,75861,1748,50,Mar,919,"['stories', 'home', 'terminally', 'children', 'kathy', 'hull']"
1942,TED,what i learned from 2 000 obituaries   lux narayan,23/03/2017,158814,3000,96,Mar,369,"['learned', '2', '000', 'obituaries', 'lux', 'narayan']"
1943,TED,this app makes it fun to pick up litter   jeff kirschner,22/03/2017,132912,4362,251,Mar,371,"['app', 'makes', 'fun', 'pick', 'litter', 'jeff', 'kirschner']"
1944,TED,the data behind hollywood s sexism   stacy smith,21/03/2017,115663,2283,1084,Mar,945,"['data', 'behind', 'hollywood', 'sexism', 'stacy', 'smith']"
1945,TED,a few ways to fix a government   charity wayua,20/03/2017,78531,2012,282,Mar,712,"['ways', 'fix', 'government', 'charity', 'wayua']"
1946,TED,smelfies  and other experiments in synthetic biology   ani liu,17/03/2017,72313,1285,63,Mar,441,"['smelfies', 'experiments', 'synthetic', 'biology', 'ani', 'liu']"
1947,TED,how to practice safe sexting   amy adele hasinoff,16/03/2017,151439,2382,350,Mar,866,"['practice', 'safe', 'sexting', 'amy', 'adele', 'hasinoff']"
1948,TED,a robot that eats pollution   jonathan rossiter,15/03/2017,135977,3373,320,Mar,851,"['robot', 'eats', 'pollution', 'jonathan', 'rossiter']"
1950,TED,don t fear superintelligent ai   grady booch,13/03/2017,263207,5596,1231,Mar,621,"['fear', 'superintelligent', 'grady', 'booch']"
1951,TED,how jails extort the poor   salil dudani,10/03/2017,86719,2171,209,Mar,764,"['jails', 'extort', 'poor', 'salil', 'dudani']"
1952,TED,3 ways to fix a broken news industry   lara setrakian,09/03/2017,99459,2502,330,Mar,518,"['3', 'ways', 'fix', 'broken', 'news', 'industry', 'lara', 'setrakian']"
1953,TED,an electrifying acoustic guitar performance   rodrigo y gabriela,09/03/2017,1654709,17521,640,Mar,258,"['electrifying', 'acoustic', 'guitar', 'performance', 'rodrigo', 'gabriela']"
1956,TED,i grew up in the westboro baptist church  here s why i left   megan phelps roper,06/03/2017,6571927,192648,17309,Mar,918,"['grew', 'westboro', 'baptist', 'church', 'left', 'megan', 'phelps', 'roper']"
1957,TED,4 ways to make a city more walkable   jeff speck,02/03/2017,1047766,33908,1253,Mar,1118,"['4', 'ways', 'city', 'walkable', 'jeff', 'speck']"
1958,TED,new nanotech to detect cancer early   joshua smith,01/03/2017,87313,2095,142,Mar,747,"['nanotech', 'detect', 'cancer', 'early', 'joshua', 'smith']"
1959,TED,the incredible inventions of intuitive ai   maurice conti,28/02/2017,5531327,126789,9310,Feb,924,"['incredible', 'inventions', 'intuitive', 'maurice', 'conti']"
1961,TED,what time is it on mars    nagin cox,24/02/2017,128957,3486,207,Feb,828,"['time', 'mars', 'nagin', 'cox']"
1962,TED,eduardo briceño  how to get better at the things you care about   ted,23/02/2017,549344,14626,306,Feb,683,"['eduardo', 'briceño', 'get', 'better', 'things', 'care']"
1963,TED,why you should love statistics   alan smith,22/02/2017,459988,9104,296,Feb,770,"['love', 'statistics', 'alan', 'smith']"
1964,TED,nationalism vs  globalism  the new political divide   yuval noah harari,21/02/2017,1812337,34583,5418,Feb,3609,"['nationalism', 'vs', 'globalism', 'political', 'divide', 'yuval', 'noah', 'harari']"
1965,TED,help discover ancient ruins    before it s too late   sarah parcak,20/02/2017,84979,2082,194,Feb,1263,"['help', 'discover', 'ancient', 'ruins', 'late', 'sarah', 'parcak']"
1966,TED,a young scientist s quest for clean water   deepika kurup,17/02/2017,107348,1797,139,Feb,480,"['young', 'scientist', 'quest', 'clean', 'water', 'deepika', 'kurup']"
1968,TED,where is cybercrime really coming from    caleb barlow,15/02/2017,275137,3994,315,Feb,868,"['cybercrime', 'really', 'coming', 'caleb', 'barlow']"
1969,TED,buildings that blend nature and city   jeanne gang,14/02/2017,270339,7554,282,Feb,716,"['buildings', 'blend', 'nature', 'city', 'jeanne', 'gang']"
1971,TED,the ethical dilemma of designer babies   paul knoepfler,10/02/2017,411208,6217,1182,Feb,1100,"['ethical', 'dilemma', 'designer', 'babies', 'paul', 'knoepfler']"
1972,TED,how to have better political conversations   robb willer,09/02/2017,229222,4854,494,Feb,722,"['better', 'political', 'conversations', 'robb', 'willer']"
1973,TED,art made of the air we breathe    emily parsons lord,08/02/2017,77078,1041,100,Feb,650,"['art', 'made', 'air', 'breathe', 'emily', 'parsons', 'lord']"
1974,TED,how to gain control of your free time   laura vanderkam,07/02/2017,7871041,181455,2417,Feb,715,"['control', 'free', 'time', 'laura', 'vanderkam']"
1975,TED,will automation take away all our jobs    david autor,06/02/2017,476882,7647,1249,Feb,1118,"['automation', 'take', 'away', 'jobs', 'david', 'autor']"
1976,TED,to solve old problems  study new species   alejandro sánchez alvarado,03/02/2017,105127,2521,90,Feb,760,"['solve', 'old', 'problems', 'study', 'species', 'alejandro', 'sánchez', 'alvarado']"
1977,TED,sisonke msimang  if a story moves you  act on it   ted,02/02/2017,97118,2988,163,Feb,767,"['sisonke', 'msimang', 'story', 'moves', 'act']"
1978,TED,meet the inventor of the electronic spreadsheet   dan bricklin,01/02/2017,357266,10137,459,Feb,720,"['meet', 'inventor', 'electronic', 'spreadsheet', 'dan', 'bricklin']"
1979,TED,the next step in nanotechnology   george tulevski,31/01/2017,488542,8241,450,Jan,576,"['step', 'nanotechnology', 'george', 'tulevski']"
1980,TED,want kids to learn well  feed them well   sam kass,30/01/2017,154153,2608,192,Jan,729,"['want', 'kids', 'learn', 'well', 'feed', 'well', 'kass']"
1981,TED,a better way to talk about love   mandy len catron,27/01/2017,300258,5535,226,Jan,918,"['better', 'love', 'mandy', 'len', 'catron']"
1982,TED,the lies we tell pregnant women   sofia jawed wessel,26/01/2017,847412,27335,2399,Jan,819,"['lies', 'tell', 'pregnant', 'women', 'sofia', 'jawed', 'wessel']"
1983,TED,the world doesn t need more nuclear weapons   erika gregory,25/01/2017,77343,1939,423,Jan,900,"['world', 'nuclear', 'weapons', 'erika', 'gregory']"
1984,TED,are you a giver or a taker    adam grant,24/01/2017,3610512,91764,2656,Jan,809,"['giver', 'taker', 'adam', 'grant']"
1985,TED,it s time to reclaim religion   sharon brous,23/01/2017,109812,2322,1622,Jan,988,"['time', 'reclaim', 'religion', 'sharon', 'brous']"
1986,TED,how we explore unanswered questions in physics   james beacham,20/01/2017,105560,3071,233,Jan,955,"['explore', 'unanswered', 'questions', 'physics', 'james', 'beacham']"
1987,TED,why earth may someday look like mars   anjali tripathi,19/01/2017,111813,2648,272,Jan,716,"['earth', 'may', 'someday', 'look', 'like', 'mars', 'anjali', 'tripathi']"
1989,TED,what happens when you have a disease doctors can t diagnose   jennifer brea,17/01/2017,874900,28926,3291,Jan,1028,"['happens', 'disease', 'doctors', 'diagnose', 'jennifer', 'brea']"
1990,TED,dena simmons  how students of color confront impostor syndrome   ted,17/01/2017,116190,2440,681,Jan,621,"['dena', 'simmons', 'students', 'color', 'confront', 'impostor', 'syndrome']"
1991,TED,could a drug prevent depression and ptsd    rebecca brachman,13/01/2017,212531,4169,599,Jan,1104,"['drug', 'prevent', 'depression', 'ptsd', 'rebecca', 'brachman']"
1992,TED,how ai can bring on a second industrial revolution   kevin kelly,12/01/2017,330934,6437,483,Jan,825,"['bring', 'second', 'industrial', 'revolution', 'kevin', 'kelly']"
1993,TED,why curiosity is the key to science and medicine   kevin b  jones,11/01/2017,69462,1539,65,Jan,1034,"['curiosity', 'key', 'science', 'medicine', 'kevin', 'jones']"
1994,TED,do kids think of sperm donors as family    veerle provoost,10/01/2017,76307,1207,276,Jan,747,"['kids', 'think', 'sperm', 'donors', 'family', 'veerle', 'provoost']"
1995,TED,say your truths and seek them in others   elizabeth lesser,09/01/2017,136112,3916,147,Jan,945,"['say', 'truths', 'seek', 'others', 'elizabeth', 'lesser']"
1996,TED,what i learned from 100 days of rejection   jia jiang,06/01/2017,5717101,251468,5535,Jan,932,"['learned', '100', 'days', 'rejection', 'jia', 'jiang']"
1997,TED,let s clean up the space junk orbiting earth   natalie panek,05/01/2017,137160,2335,464,Jan,616,"['let', 'clean', 'space', 'junk', 'orbiting', 'earth', 'natalie', 'panek']"
1998,TED,a queer vision of love and marriage   tiq milan and kim katrin milan,04/01/2017,221128,4997,794,Jan,1028,"['queer', 'vision', 'love', 'marriage', 'tiq', 'milan', 'kim', 'katrin', 'milan']"
1999,TED,4 larger than life lessons from soap operas   kate adams,03/01/2017,137411,2562,119,Jan,748,"['4', 'larger', 'life', 'lessons', 'soap', 'operas', 'kate', 'adams']"
2000,TED,how an old loop of railroads is changing the face of a city   ryan gravel,22/12/2016,75736,1219,112,Dec,687,"['old', 'loop', 'railroads', 'changing', 'face', 'city', 'ryan', 'gravel']"
2001,TED,chinaka hodge  what will you tell your daughters about 2016    ted,22/12/2016,96542,2592,812,Dec,238,"['chinaka', 'hodge', 'tell', 'daughters', '2016']"
2002,TED,maps that show us who we are  not just where we are    danny dorling,21/12/2016,244337,4922,286,Dec,848,"['maps', 'show', 'danny', 'dorling']"
2003,TED,an interview with the founders of black lives matter   alicia garza  patrisse cullors  opal tometi,20/12/2016,439847,4801,7726,Dec,966,"['interview', 'founders', 'black', 'lives', 'matter', 'alicia', 'garza', 'patrisse', 'cullors', 'opal', 'tometi']"
2004,TED,we need nuclear power to solve climate change   joe lassiter,19/12/2016,124042,3715,1084,Dec,827,"['nuclear', 'power', 'solve', 'climate', 'change', 'joe', 'lassiter']"
2005,TED,how to speak up for yourself   adam galinsky,16/12/2016,858101,16301,334,Dec,909,"['speak', 'adam', 'galinsky']"
2006,TED,what will humans look like in 100 years    juan enriquez,15/12/2016,1157035,24736,1559,Dec,946,"['humans', 'look', 'like', '100', 'years', 'juan', 'enriquez']"
2007,TED,a political party for women s equality   sandi toksvig,14/12/2016,95579,3219,1016,Dec,1172,"['political', 'party', 'women', 'equality', 'sandi', 'toksvig']"
2008,TED,math is the hidden secret to understanding the world   roger antonsen,13/12/2016,1670536,47674,1675,Dec,1025,"['math', 'hidden', 'secret', 'understanding', 'world', 'roger', 'antonsen']"
2009,TED,help for kids the education system ignores   victor rios,12/12/2016,155560,3194,186,Dec,714,"['help', 'kids', 'education', 'system', 'ignores', 'victor', 'rios']"
2010,TED,the playful wonderland behind great inventions   steven johnson,09/12/2016,128384,3035,107,Dec,446,"['playful', 'wonderland', 'behind', 'great', 'inventions', 'steven', 'johnson']"
2011,TED,how the blockchain will radically transform the economy   bettina warburg,08/12/2016,2361003,34186,5682,Dec,898,"['blockchain', 'radically', 'transform', 'economy', 'bettina', 'warburg']"
2013,TED,we train soldiers for war  let s train them to come home  too   hector garcia,06/12/2016,83812,2048,191,Dec,632,"['train', 'soldiers', 'war', 'let', 'train', 'come', 'home', 'hector', 'garcia']"
2014,TED,islamophobia killed my brother  let s end the hate   suzanne barakat,05/12/2016,1035857,50145,9393,Dec,889,"['islamophobia', 'killed', 'brother', 'let', 'end', 'hate', 'suzanne', 'barakat']"
2015,TED,easy diy projects for kid engineers   fawn qiu,02/12/2016,143885,3092,193,Dec,424,"['easy', 'diy', 'projects', 'kid', 'engineers', 'fawn', 'qiu']"
2016,TED,it s time for women to run for office   halla tómasdóttir,02/12/2016,52222,1157,679,Dec,1159,"['time', 'women', 'run', 'office', 'halla', 'tómasdóttir']"
2017,TED,4 ways to build a human company in the age of machines   tim leberecht,01/12/2016,91552,1647,93,Dec,705,"['4', 'ways', 'build', 'human', 'company', 'age', 'machines', 'tim', 'leberecht']"
2018,TED,your company s data could help end world hunger   mallory freeman,29/11/2016,51254,717,100,Nov,676,"['company', 'data', 'help', 'end', 'world', 'hunger', 'mallory', 'freeman']"
2019,TED,how america s public schools keep kids in poverty   kandice sumner,28/11/2016,528897,13483,1698,Nov,831,"['america', 'public', 'schools', 'keep', 'kids', 'poverty', 'kandice', 'sumner']"
2020,TED,your smartphone is a civil rights issue   christopher soghoian,23/11/2016,167155,2265,629,Nov,465,"['smartphone', 'civil', 'rights', 'issue', 'christopher', 'soghoian']"
2022,TED, st  james infirmary blues    silk road ensemble + rhiannon giddens,22/11/2016,164241,2469,150,Nov,524,"['james', 'infirmary', 'blues', 'silk', 'road', 'ensemble', '+', 'rhiannon', 'giddens']"
2023,TED,everything you hear on film is a lie   tasos frantzolas,21/11/2016,222374,4847,297,Nov,994,"['everything', 'hear', 'film', 'lie', 'tasos', 'frantzolas']"
2024,TED,the unexpected challenges of a country s first election   philippa neave,18/11/2016,65993,787,74,Nov,652,"['unexpected', 'challenges', 'country', 'first', 'election', 'philippa', 'neave']"
2025,TED,how loss helped one artist find beauty in imperfection   alyssa monks,17/11/2016,114661,3283,132,Nov,789,"['loss', 'helped', 'one', 'artist', 'find', 'beauty', 'imperfection', 'alyssa', 'monks']"
2026,TED,how the us should use its superpower status   ian bremmer,16/11/2016,88569,1246,231,Nov,938,"['superpower', 'status', 'ian', 'bremmer']"
2027,TED,what a driverless world could look like   wanis kabbaj,15/11/2016,2421674,38632,3811,Nov,692,"['driverless', 'world', 'look', 'like', 'wanis', 'kabbaj']"
2028,TED,inside the mind of a former radical jihadist   manwar ali,14/11/2016,1038387,22073,2968,Nov,1043,"['inside', 'mind', 'former', 'radical', 'jihadist', 'manwar', 'ali']"
2029,TED,machine intelligence makes human morals more important   zeynep tufekci,11/11/2016,170929,3440,226,Nov,1063,"['machine', 'intelligence', 'makes', 'human', 'morals', 'important', 'zeynep', 'tufekci']"
2030,TED,a temporary tattoo that brings hospital care to the home   todd coleman,10/11/2016,174041,1927,201,Nov,580,"['temporary', 'tattoo', 'brings', 'hospital', 'care', 'home', 'todd', 'coleman']"
2031,TED,can a divided america heal    jonathan haidt,08/11/2016,349294,6398,874,Nov,1218,"['divided', 'america', 'heal', 'jonathan', 'haidt']"
2032,TED,we ve stopped trusting institutions and started trusting strangers   rachel botsman,07/11/2016,171690,2743,167,Nov,1029,"['stopped', 'trusting', 'institutions', 'started', 'trusting', 'strangers', 'rachel', 'botsman']"
2033,TED,ballroom dance that breaks gender roles   trevor copp and jeff fox,04/11/2016,129174,3936,629,Nov,935,"['ballroom', 'dance', 'breaks', 'gender', 'roles', 'trevor', 'copp', 'jeff', 'fox']"
2034,TED,5 ways to lead in an era of constant change   jim hemerling,03/11/2016,395473,3462,103,Nov,802,"['5', 'ways', 'lead', 'era', 'constant', 'change', 'jim', 'hemerling']"
2035,TED,art can heal ptsd s invisible wounds   melissa walker,02/11/2016,111125,2005,152,Nov,589,"['art', 'heal', 'ptsd', 'invisible', 'wounds', 'melissa', 'walker']"
2036,TED,the beauty of what we ll never know   pico iyer   ted,01/11/2016,143594,3022,126,Nov,606,"['beauty', 'never', 'know', 'pico', 'iyer']"
2037,TED,how we talk about sexual assault online   ione wells,31/10/2016,115243,3045,599,Oct,850,"['sexual', 'assault', 'online', 'ione', 'wells']"
2038,TED,4 reasons to learn a new language   john mcwhorter,28/10/2016,1752501,35938,1783,Oct,602,"['4', 'reasons', 'learn', 'language', 'john', 'mcwhorter']"
2039,TED,isaac lidsky  what reality are you creating for yourself    ted,27/10/2016,615969,19590,400,Oct,707,"['isaac', 'lidsky', 'reality', 'creating']"
2040,TED,we can start winning the war against cancer   adam de la zerda,26/10/2016,61846,1456,152,Oct,763,"['start', 'winning', 'war', 'cancer', 'adam', 'la', 'zerda']"
2041,TED,immigrant voices make democracy stronger   sayu bhojwani,25/10/2016,83892,1132,517,Oct,763,"['immigrant', 'voices', 'democracy', 'stronger', 'sayu', 'bhojwani']"
2042,TED,what you need to know about crispr   ellen jorgensen,24/10/2016,860841,14161,840,Oct,594,"['know', 'crispr', 'ellen', 'jorgensen']"
2043,TED,technology hasn t changed love  here s why   helen fisher,20/10/2016,191689,2997,197,Oct,1146,"['technology', 'changed', 'love', 'helen', 'fisher']"
2044,TED,can we build ai without losing control over it    sam harris,19/10/2016,3616138,80007,10401,Oct,868,"['build', 'without', 'losing', 'control', 'harris']"
2045,TED,how we re harnessing nature s hidden superpowers   oded shoseyov,18/10/2016,134349,3448,159,Oct,802,"['harnessing', 'nature', 'hidden', 'superpowers', 'oded', 'shoseyov']"
2046,TED,america s forgotten working class   j d  vance,17/10/2016,316532,6705,741,Oct,883,"['america', 'forgotten', 'working', 'class', 'vance']"
2047,TED,we can fight terror without sacrificing our rights   rebecca mackinnon,14/10/2016,62643,1189,172,Oct,717,"['fight', 'terror', 'without', 'sacrificing', 'rights', 'rebecca', 'mackinnon']"
2048,TED,the era of personal dna testing is here   sebastian kraves,13/10/2016,93520,1572,127,Oct,785,"['era', 'personal', 'dna', 'testing', 'sebastian', 'kraves']"
2049,TED,why open a school  to close a prison   nadia lopez,12/10/2016,99355,2768,171,Oct,431,"['open', 'school', 'close', 'prison', 'nadia', 'lopez']"
2050,TED,why you should know how much your coworkers get paid   david burkus,11/10/2016,193673,2798,373,Oct,450,"['know', 'much', 'coworkers', 'get', 'paid', 'david', 'burkus']"
2051,TED,there s no such thing as not voting   eric liu,10/10/2016,103723,1710,459,Oct,814,"['thing', 'voting', 'eric', 'liu']"
2052,TED,why some people are more altruistic than others   abigail marsh,07/10/2016,339002,6628,641,Oct,742,"['people', 'altruistic', 'others', 'abigail', 'marsh']"
2053,TED,architecture that s built to heal   michael murphy,06/10/2016,256989,8659,190,Oct,939,"['architecture', 'built', 'heal', 'michael', 'murphy']"
2054,TED,how fear of nuclear power is hurting the environment   michael shellenberger,05/10/2016,543580,21899,4192,Oct,839,"['fear', 'nuclear', 'power', 'hurting', 'environment', 'michael', 'shellenberger']"
2055,TED,how to raise successful kids    without over parenting   julie lythcott haims   ted,04/10/2016,3401261,86511,2005,Oct,857,"['raise', 'successful', 'kids', 'without', 'parenting', 'julie', 'lythcott', 'haims']"
2056,TED,the future of money   neha narula,03/10/2016,388681,5710,691,Oct,977,"['future', 'money', 'neha', 'narula']"
2057,TED,a new way to heal hearts without surgery   franz freudenthal,30/09/2016,108041,2351,122,Sep,569,"['heal', 'hearts', 'without', 'surgery', 'franz', 'freudenthal']"
2058,TED,why helmets don t prevent concussions    and what might   david camarillo,29/09/2016,277286,4241,358,Sep,957,"['helmets', 'prevent', 'concussions', 'david', 'camarillo']"
2059,TED,the new american dream   courtney martin,28/09/2016,226197,3147,305,Sep,933,"['american', 'dream', 'courtney', 'martin']"
2060,TED,let s teach for mastery    not test scores   sal khan,26/09/2016,2102622,76693,3440,Sep,650,"['let', 'teach', 'mastery', 'test', 'scores', 'sal', 'khan']"
2061,TED,the risky politics of progress   jonathan tepperman,24/09/2016,62619,1288,207,Sep,1097,"['risky', 'politics', 'progress', 'jonathan', 'tepperman']"
2062,TED,why you should talk to strangers   kio stark,23/09/2016,611454,9947,602,Sep,713,"['strangers', 'kio', 'stark']"
2063,TED,bring on the female superheroes    christopher bell,22/09/2016,125608,5370,730,Sep,949,"['bring', 'female', 'superheroes', 'christopher', 'bell']"
2064,TED,how women wage conflict without violence   julia bacha,20/09/2016,69853,1183,410,Sep,748,"['women', 'wage', 'conflict', 'without', 'violence', 'julia', 'bacha']"
2065,TED,the spellbinding art of human anatomy   vanessa ruiz,19/09/2016,119381,2576,74,Sep,683,"['spellbinding', 'art', 'human', 'anatomy', 'vanessa', 'ruiz']"
2066,TED,how the blockchain is changing money and business   don tapscott,16/09/2016,4940447,81589,26417,Sep,1130,"['blockchain', 'changing', 'money', 'business', 'tapscott']"
2067,TED,the deadly legacy of cluster bombs   laura boushnak,15/09/2016,90830,1056,160,Sep,697,"['deadly', 'legacy', 'cluster', 'bombs', 'laura', 'boushnak']"
2068,TED,what we can do to die well   timothy ihrig,14/09/2016,85796,1468,105,Sep,813,"['die', 'well', 'timothy', 'ihrig']"
2069,TED,the next manufacturing revolution is here   olivier scalabre,13/09/2016,479626,5592,622,Sep,747,"['manufacturing', 'revolution', 'olivier', 'scalabre']"
2070,TED,a letter to all who have lost in this era   anand giridharadas,12/09/2016,97790,2244,269,Sep,1046,"['letter', 'lost', 'era', 'anand', 'giridharadas']"
2071,TED,gonzalo vilariño  how argentina s blind soccer team became champions  with english subtitles    ted,09/09/2016,62621,710,88,Sep,859,"['gonzalo', 'vilariño', 'argentina', 'blind', 'soccer', 'team', 'became', 'champions', 'english', 'subtitles']"
2072,TED,hunting for peru s lost civilizations    with satellites   sarah parcak,08/09/2016,116336,1327,151,Sep,420,"['hunting', 'peru', 'lost', 'civilizations', 'satellites', 'sarah', 'parcak']"
2073,TED,3 moons and a planet that could have alien life   james green,07/09/2016,354708,4408,516,Sep,640,"['3', 'moons', 'planet', 'alien', 'life', 'james', 'green']"
2074,TED,a small country with big ideas to get rid of fossil fuels   monica araya,06/09/2016,177050,3890,413,Sep,953,"['small', 'country', 'big', 'ideas', 'get', 'rid', 'fossil', 'fuels', 'monica', 'araya']"
2075,TED,what a planet needs to sustain life   dave brain,04/09/2016,391800,7549,373,Sep,823,"['planet', 'needs', 'sustain', 'life', 'dave', 'brain']"
2076,TED,how africa can keep rising   ngozi okonjo iweala,03/09/2016,91212,2122,332,Sep,924,"['africa', 'keep', 'rising', 'ngozi', 'okonjo', 'iweala']"
2077,TED,the taboo secret to better health   molly winter,02/09/2016,320868,4017,344,Sep,742,"['taboo', 'secret', 'better', 'health', 'molly', 'winter']"
2078,TED,how to build a business that lasts 100 years   martin reeves,01/09/2016,268437,3905,109,Sep,895,"['build', 'business', 'lasts', '100', 'years', 'martin', 'reeves']"
2079,TED,the jobs we ll lose to machines    and the ones we won t   anthony goldbloom,31/08/2016,531580,7890,820,Aug,277,"['jobs', 'lose', 'machines', 'ones', 'anthony', 'goldbloom']"
2080,TED,how trees talk to each other   suzanne simard,30/08/2016,2100879,51076,2159,Aug,1105,"['trees', 'suzanne', 'simard']"
2081,TED,a new way to study the brain s invisible secrets   ed boyden,29/08/2016,143903,2875,135,Aug,796,"['study', 'brain', 'invisible', 'secrets', 'boyden']"
2082,TED,how the panama papers journalists broke the biggest leak in history   gerard ryle,26/08/2016,115725,2623,206,Aug,789,"['panama', 'papers', 'journalists', 'broke', 'biggest', 'leak', 'history', 'gerard', 'ryle']"
2083,TED,a project of peace  painted across 50 buildings   el seed,25/08/2016,119769,2806,96,Aug,687,"['project', 'peace', 'painted', 'across', '50', 'buildings', 'seed']"
2084,TED,a forgotten space age technology could change how we grow food   lisa dyson,24/08/2016,99962,2301,178,Aug,716,"['forgotten', 'space', 'age', 'technology', 'change', 'grow', 'food', 'lisa', 'dyson']"
2085,TED,my love letter to cosplay   adam savage,23/08/2016,1843660,104516,2152,Aug,788,"['love', 'letter', 'cosplay', 'adam', 'savage']"
2086,TED,how to grow a forest in your backyard   shubhendu sharma,22/08/2016,2169750,69126,2199,Aug,552,"['grow', 'forest', 'backyard', 'shubhendu', 'sharma']"
2087,TED,nature is everywhere    we just need to learn to see it   emma marris,19/08/2016,145921,3050,161,Aug,953,"['nature', 'everywhere', 'learn', 'see', 'emma', 'marris']"
2088,TED,3 lessons on success from an arab businesswoman   leila hoteit,17/08/2016,288597,5690,414,Aug,843,"['3', 'lessons', 'success', 'arab', 'businesswoman', 'leila', 'hoteit']"
2089,TED,when we design for disability  we all benefit   elise roy,16/08/2016,121079,2013,144,Aug,798,"['design', 'disability', 'benefit', 'elise', 'roy']"
2090,TED,why i keep speaking up  even when people mock my accent   safwat saleem,15/08/2016,203323,4877,360,Aug,649,"['keep', 'speaking', 'even', 'people', 'mock', 'accent', 'safwat', 'saleem']"
2091,TED,why brexit happened    and what to do next   alexander betts,12/08/2016,1846799,25751,8560,Aug,1043,"['brexit', 'happened', 'alexander', 'betts']"
2092,TED,how syria s architecture laid the foundation for brutal war   marwa al sabouni,11/08/2016,124331,1748,320,Aug,626,"['syria', 'architecture', 'laid', 'foundation', 'brutal', 'war', 'marwa', 'sabouni']"
2093,TED, redemption song    john legend,10/08/2016,308698,4103,159,Aug,519,"['redemption', 'song', 'john', 'legend']"
2094,TED,clues to prehistoric times  found in blind cavefish   prosanta chakrabarty,09/08/2016,75431,1744,88,Aug,290,"['clues', 'prehistoric', 'times', 'found', 'blind', 'cavefish', 'prosanta', 'chakrabarty']"
2095,TED,why you think you re right    even if you re wrong   julia galef,08/08/2016,1986751,53492,2739,Aug,698,"['think', 'right', 'even', 'wrong', 'julia', 'galef']"
2096,TED,how computers are learning to be creative   blaise agüera y arcas,22/07/2016,432629,9366,459,Jul,1055,"['computers', 'learning', 'creative', 'blaise', 'agüera', 'arcas']"
