,channelTitle,title,publishedAt,viewCount,likeCount,commentCount,month,duration_by_secs,title_new
944,TED,a camera that can see around corners   david lindell,21/04/2020,91008,3494,271,Apr,455,"['camera', 'see', 'around', 'corners', 'david', 'lindell']"
945,TED,the weird history of the  sex chromosomes    molly webster,21/04/2020,193817,2436,400,Apr,815,"['weird', 'history', 'sex', 'chromosomes', 'molly', 'webster']"
946,TED,how repaying loans with social service transforms communities   angie murimirwa,20/04/2020,13694,333,18,Apr,664,"['repaying', 'loans', 'social', 'service', 'transforms', 'communities', 'angie', 'murimirwa']"
947,TED,go ahead  dream about the future   charlie jane anders   ted,20/04/2020,115925,2866,474,Apr,716,"['go', 'ahead', 'dream', 'future', 'charlie', 'jane', 'anders']"
948,TED,what happens when a silicon valley technologist works for the government   matt cutts,18/04/2020,54310,931,36,Apr,365,"['happens', 'silicon', 'valley', 'technologist', 'works', 'government', 'matt', 'cutts']"
949,TED,without farmers  you d be hungry  naked and sober   eric sannerud,18/04/2020,89506,2547,229,Apr,542,"['without', 'farmers', 'hungry', 'naked', 'sober', 'eric', 'sannerud']"
950,TED,spectacular  glorious  musical wizardry   jacob collier,17/04/2020,610268,23240,1334,Apr,2248,"['spectacular', 'glorious', 'musical', 'wizardry', 'jacob', 'collier']"
951,TED,the dangers of a noisy ocean    and how we can quiet it down   nicola jones,16/04/2020,64470,1708,107,Apr,784,"['dangers', 'noisy', 'ocean', 'quiet', 'nicola', 'jones']"
952,TED,why it s so hard to talk about the n word   elizabeth stordeur pryor,16/04/2020,98609,2496,668,Apr,1162,"['hard', 'word', 'elizabeth', 'stordeur', 'pryor']"
953,TED,the beautiful  mysterious science of how you hear   jim hudspeth,15/04/2020,103142,2876,128,Apr,943,"['beautiful', 'mysterious', 'science', 'hear', 'jim', 'hudspeth']"
954,TED,a campaign for period positivity   ananya grover,15/04/2020,18275,499,23,Apr,549,"['campaign', 'period', 'positivity', 'ananya', 'grover']"
955,TED,a fascinating time capsule of human feelings toward ai   lucy farey jones,14/04/2020,52033,1053,81,Apr,387,"['fascinating', 'time', 'capsule', 'human', 'feelings', 'toward', 'lucy', 'farey', 'jones']"
956,TED,how health workers are responding to the covid 19 pandemic   esther choo,14/04/2020,43697,690,76,Apr,2804,"['health', 'workers', 'responding', 'covid', '19', 'pandemic', 'esther', 'choo']"
957,TED,how menopause affects the brain   lisa mosconi,13/04/2020,1462223,44850,2288,Apr,785,"['menopause', 'affects', 'brain', 'lisa', 'mosconi']"
958,TED,how we could change the planet s climate future   david wallace wells,13/04/2020,63622,1714,203,Apr,682,"['change', 'planet', 'climate', 'future', 'david', 'wallace', 'wells']"
959,TED,how the coronavirus pandemic is changing the world   fareed zakaria,13/04/2020,621109,7933,1317,Apr,1983,"['coronavirus', 'pandemic', 'changing', 'world', 'fareed', 'zakaria']"
960,TED,how women are revolutionizing rwanda   agnes binagwaho,10/04/2020,30818,674,27,Apr,724,"['women', 'revolutionizing', 'rwanda', 'agnes', 'binagwaho']"
961,TED,how the coronavirus is impacting india    and what needs to happen next   gayathri vasudevan,10/04/2020,72544,1156,143,Apr,1236,"['coronavirus', 'impacting', 'india', 'needs', 'happen', 'gayathri', 'vasudevan']"
962,TED,a global hackathon to take on the coronavirus pandemic   marko russiver,09/04/2020,50711,774,68,Apr,874,"['global', 'hackathon', 'take', 'coronavirus', 'pandemic', 'marko', 'russiver']"
963,TED,what coronavirus means for the global economy   ray dalio,09/04/2020,1762989,28214,3039,Apr,3161,"['coronavirus', 'means', 'global', 'economy', 'ray', 'dalio']"
964,TED,an ethical plan for ending the pandemic and restarting the economy   danielle allen,08/04/2020,55562,865,150,Apr,3008,"['ethical', 'plan', 'ending', 'pandemic', 'restarting', 'economy', 'danielle', 'allen']"
965,TED,what investigating neural pathways can reveal about mental health   kay m  tye,07/04/2020,75535,2216,180,Apr,780,"['investigating', 'neural', 'pathways', 'reveal', 'mental', 'health', 'kay', 'tye']"
966,TED,how a miniaturized atomic clock could revolutionize space exploration   jill seubert,06/04/2020,97317,2464,190,Apr,681,"['miniaturized', 'atomic', 'clock', 'revolutionize', 'space', 'exploration', 'jill', 'seubert']"
967,TED,art that reveals how technology frames reality   jiabao li,06/04/2020,77337,2318,108,Apr,502,"['art', 'reveals', 'technology', 'frames', 'reality', 'jiabao', 'li']"
968,TED,it s ok to feel overwhelmed  here s what to do next   elizabeth gilbert,05/04/2020,295819,5799,341,Apr,3741,"['ok', 'feel', 'overwhelmed', 'elizabeth', 'gilbert']"
969,TED,why sleep matters now more than ever   matt walker,03/04/2020,136914,3006,193,Apr,3642,"['sleep', 'matters', 'ever', 'matt', 'walker']"
970,TED,the gender fluid history of the philippines   france villarta,03/04/2020,132647,6992,726,Apr,652,"['gender', 'fluid', 'history', 'philippines', 'france', 'villarta']"
971,TED,how to make pandemics optional  not inevitable   sonia shah,01/04/2020,53214,789,152,Apr,2626,"['pandemics', 'optional', 'inevitable', 'sonia', 'shah']"
972,TED,when local news dies  so does democracy   chuck plunkett,01/04/2020,48039,1388,150,Apr,672,"['local', 'news', 'dies', 'democracy', 'chuck', 'plunkett']"
973,TED,how to turn climate anxiety into action   renée lertzman,31/03/2020,41395,984,87,Mar,838,"['turn', 'climate', 'anxiety', 'action', 'renée', 'lertzman']"
974,TED,how we can navigate the pandemic with courage and hope   rabbi lord jonathan sacks,31/03/2020,63653,1071,121,Mar,3879,"['navigate', 'pandemic', 'courage', 'hope', 'rabbi', 'lord', 'jonathan', 'sacks']"
975,TED,what you need to know about stalkerware   eva galperin,30/03/2020,105628,3778,254,Mar,777,"['know', 'stalkerware', 'eva', 'galperin']"
976,TED,how to create meaningful connections while apart   priya parker,30/03/2020,62897,1068,42,Mar,3011,"['create', 'meaningful', 'connections', 'apart', 'priya', 'parker']"
977,TED,the quest for the coronavirus vaccine   seth berkley,28/03/2020,150839,2064,287,Mar,3761,"['quest', 'coronavirus', 'vaccine', 'seth', 'berkley']"
978,TED,music and art in a time of protest   denise ho,27/03/2020,37356,1188,186,Mar,895,"['music', 'art', 'time', 'protest', 'denise']"
979,TED,what the world can learn from china’s response to the coronavirus   gary liu,27/03/2020,142435,3021,2211,Mar,3504,"['world', 'learn', 'china’', 'response', 'coronavirus', 'gary', 'liu']"
980,TED,how bumble bees inspired a network of tiny museums   amanda schochet,27/03/2020,36818,1086,40,Mar,668,"['bumble', 'bees', 'inspired', 'network', 'tiny', 'museums', 'amanda', 'schochet']"
981,TED,3 ways to uproot a culture of corruption   wanjira mathai,26/03/2020,23554,605,27,Mar,648,"['3', 'ways', 'uproot', 'culture', 'corruption', 'wanjira', 'mathai']"
982,TED,how to design gender bias out of your workplace   sara sanford,26/03/2020,84705,1670,445,Mar,807,"['design', 'gender', 'bias', 'workplace', 'sara', 'sanford']"
983,TED,how we must respond to the coronavirus pandemic   bill gates,25/03/2020,4871130,73901,16985,Mar,3111,"['respond', 'coronavirus', 'pandemic', 'bill', 'gates']"
984,TED,how to be your best self in times of crisis   susan david,25/03/2020,143906,2444,124,Mar,2764,"['best', 'times', 'crisis', 'susan', 'david']"
985,TED,how technology has changed what it s like to be deaf   rebecca knill,24/03/2020,80388,1962,82,Mar,839,"['technology', 'changed', 'like', 'deaf', 'rebecca', 'knill']"
986,TED,management lessons from chinese business and philosophy   fang ruan,24/03/2020,57385,1023,38,Mar,651,"['management', 'lessons', 'chinese', 'business', 'philosophy', 'fang', 'ruan']"
987,TED,what if a single human right could change the world    kristen wenz,23/03/2020,98720,2565,198,Mar,495,"['single', 'human', 'right', 'change', 'world', 'kristen', 'wenz']"
988,TED,how volumetric video brings a new dimension to filmmaking   diego prilusky,19/03/2020,108030,2518,136,Mar,704,"['volumetric', 'video', 'brings', 'dimension', 'filmmaking', 'diego', 'prilusky']"
989,TED,why you should get paid for your data   jennifer zhu scott,19/03/2020,75660,2133,148,Mar,868,"['get', 'paid', 'data', 'jennifer', 'zhu', 'scott']"
990,TED,the real reason you procrastinate   worklife with adam grant  audio only ,18/03/2020,134102,2818,124,Mar,2183,"['real', 'reason', 'procrastinate', 'worklife', 'adam', 'grant', 'audio']"
991,TED,this is your brain on air pollution   maría neira,18/03/2020,88240,2248,163,Mar,773,"['brain', 'air', 'pollution', 'maría', 'neira']"
992,TED,how can we control the coronavirus pandemic    adam kucharski,16/03/2020,273159,3338,319,Mar,218,"['control', 'coronavirus', 'pandemic', 'adam', 'kucharski']"
993,TED,joel leon  the beautiful  hard work of co parenting   ted,13/03/2020,109223,2655,128,Mar,566,"['joel', 'leon', 'beautiful', 'hard', 'work', 'parenting']"
994,TED,a brief tour of the last 4 billion years  dinosaurs not included    lauren sallan,10/03/2020,125896,3136,243,Mar,529,"['brief', 'tour', 'last', '4', 'billion', 'years', 'dinosaurs', 'included', 'lauren', 'sallan']"
995,TED,for the love of fangirls   yve blake,10/03/2020,107137,7769,650,Mar,723,"['love', 'fangirls', 'yve', 'blake']"
996,TED,the perks of being a pirate   tom nash,09/03/2020,761643,30787,1255,Mar,536,"['perks', 'pirate', 'tom', 'nash']"
997,TED,online predators spread fake porn of me  here s how i fought back   noelle martin,09/03/2020,51315,718,90,Mar,707,"['online', 'predators', 'spread', 'fake', 'porn', 'fought', 'back', 'noelle', 'martin']"
998,TED,debbie millman  how symbols and brands shape our humanity   ted,06/03/2020,149689,3146,157,Mar,853,"['debbie', 'millman', 'symbols', 'brands', 'shape', 'humanity']"
999,TED,what we do  and don t  know about the coronavirus   david heymann,05/03/2020,490281,7746,633,Mar,487,"['know', 'coronavirus', 'david', 'heymann']"
1000,TED,what a nun can teach a scientist about ecology   victoria gill,04/03/2020,52031,1114,114,Mar,840,"['nun', 'teach', 'scientist', 'ecology', 'victoria', 'gill']"
1001,TED,how teachers can help students navigate trauma   lisa godwin,03/03/2020,81233,2201,132,Mar,921,"['teachers', 'help', 'students', 'navigate', 'trauma', 'lisa', 'godwin']"
1002,TED,imaginative sculptures that explore how we perceive reality   alicia eggert,03/03/2020,40468,1006,122,Mar,630,"['imaginative', 'sculptures', 'explore', 'perceive', 'reality', 'alicia', 'eggert']"
1003,TED,what if the poor were part of city planning    smruti jukur johari,28/02/2020,162393,6559,308,Feb,808,"['poor', 'part', 'city', 'planning', 'smruti', 'jukur', 'johari']"
1004,TED,how bees can keep the peace between elephants and humans   lucy king,28/02/2020,78177,2570,162,Feb,804,"['bees', 'keep', 'peace', 'elephants', 'humans', 'lucy', 'king']"
1005,TED,rayma suprani  dictators hate political cartoons    so i keep drawing them   ted,27/02/2020,89953,2958,226,Feb,1003,"['rayma', 'suprani', 'dictators', 'hate', 'political', 'cartoons', 'keep', 'drawing']"
1006,TED,the science of friction    and its surprising impact on our lives   jennifer vail,27/02/2020,57932,1177,88,Feb,708,"['science', 'friction', 'surprising', 'impact', 'lives', 'jennifer', 'vail']"
1007,TED,the health benefits of clowning around   matthew a  wilson,26/02/2020,73594,2007,117,Feb,449,"['health', 'benefits', 'clowning', 'around', 'matthew', 'wilson']"
1008,TED,the real story of rosa parks    and why we need to confront myths about black history   david ikard,26/02/2020,96028,3210,441,Feb,1094,"['real', 'story', 'rosa', 'parks', 'confront', 'myths', 'black', 'history', 'david', 'ikard']"
1009,TED,parasitic worms hold back human progress  here s how we can end them   ellen agler,25/02/2020,63757,1788,147,Feb,289,"['parasitic', 'worms', 'hold', 'back', 'human', 'progress', 'end', 'ellen', 'agler']"
1010,TED,tiny robots with giant potential   paul mceuen and marc miskin,25/02/2020,60742,1835,127,Feb,791,"['tiny', 'robots', 'giant', 'potential', 'paul', 'mceuen', 'marc', 'miskin']"
1011,TED,how virtual reality turns students into scientists   jessica ochoa hendrix,20/02/2020,138356,2738,140,Feb,395,"['virtual', 'reality', 'turns', 'students', 'scientists', 'jessica', 'ochoa', 'hendrix']"
1012,TED,a new type of medicine  custom made with tiny proteins   christopher bahl,19/02/2020,78255,2295,94,Feb,282,"['type', 'medicine', 'custom', 'made', 'tiny', 'proteins', 'christopher', 'bahl']"
1013,TED,how the magic of kindness helped me survive the holocaust   werner reich,18/02/2020,103407,3887,155,Feb,662,"['magic', 'kindness', 'helped', 'survive', 'holocaust', 'werner', 'reich']"
1014,TED,what ocean microbes reveal about the changing climate   angelicque white,18/02/2020,55183,1417,114,Feb,786,"['ocean', 'microbes', 'reveal', 'changing', 'climate', 'angelicque', 'white']"
1015,TED,the unpaid work that gdp ignores    and why it really counts   marilyn waring,17/02/2020,69531,1809,166,Feb,1040,"['unpaid', 'work', 'gdp', 'ignores', 'really', 'counts', 'marilyn', 'waring']"
1016,TED,how motivation can fix public systems   abhishek gopalka,15/02/2020,76175,1671,101,Feb,848,"['motivation', 'fix', 'public', 'systems', 'abhishek', 'gopalka']"
1017,TED,how online marketplaces can help local economies  not hurt them   amane dannouni,14/02/2020,69836,1178,53,Feb,748,"['online', 'marketplaces', 'help', 'local', 'economies', 'hurt', 'amane', 'dannouni']"
1018,TED,how supply chain transparency can help the planet   markus mutz,14/02/2020,61547,1016,40,Feb,810,"['supply', 'chain', 'transparency', 'help', 'planet', 'markus', 'mutz']"
1019,TED,why gender based marketing is bad for business   gaby barrios,14/02/2020,32639,497,49,Feb,650,"['gender', 'based', 'marketing', 'bad', 'business', 'gaby', 'barrios']"
1020,TED,why i draw with robots   sougwen chung,14/02/2020,24143,498,25,Feb,511,"['draw', 'robots', 'sougwen', 'chung']"
1021,TED,how humans and ai can work together to create better businesses   sylvain duranton,14/02/2020,25278,422,15,Feb,851,"['humans', 'work', 'together', 'create', 'better', 'businesses', 'sylvain', 'duranton']"
1022,TED,to challenge the status quo  find a  co conspirator    ipsita dasgupta,14/02/2020,13810,210,4,Feb,664,"['challenge', 'status', 'quo', 'find', 'conspirator', 'ipsita', 'dasgupta']"
1023,TED,a guide to collaborative leadership   lorna davis,14/02/2020,130035,3705,59,Feb,853,"['guide', 'collaborative', 'leadership', 'lorna', 'davis']"
1024,TED,does photographing a moment steal the experience from you    erin sullivan,14/02/2020,141399,5216,244,Feb,504,"['photographing', 'moment', 'steal', 'experience', 'erin', 'sullivan']"
1025,TED,a personal health coach for those living with chronic diseases   priscilla pemu,13/02/2020,64601,1593,131,Feb,470,"['personal', 'health', 'coach', 'living', 'chronic', 'diseases', 'priscilla', 'pemu']"
1026,TED,the evolution of the coffee cup lid   small thing big idea  a ted series,12/02/2020,126802,2931,133,Feb,196,"['evolution', 'coffee', 'cup', 'lid', 'small', 'thing', 'big', 'idea', 'series']"
1027,TED,how designing brand new enzymes could change the world   adam garske,11/02/2020,67313,1602,76,Feb,793,"['designing', 'brand', 'enzymes', 'change', 'world', 'adam', 'garske']"
1028,TED,how surfboards connect us to nature   small thing big idea  a ted series,11/02/2020,172641,3351,76,Feb,217,"['surfboards', 'connect', 'nature', 'small', 'thing', 'big', 'idea', 'series']"
1029,TED,5 ways to create stronger connections   the way we work  a ted series,10/02/2020,190949,3073,41,Feb,187,"['5', 'ways', 'create', 'stronger', 'connections', 'work', 'series']"
1030,TED,how to know if it’s time to change careers   the way we work  a ted series,10/02/2020,266396,6250,155,Feb,269,"['know', '’', 'time', 'change', 'careers', 'work', 'series']"
1031,TED,3 things new parents should consider before going back to work   the way we work  a ted series,10/02/2020,52743,635,61,Feb,324,"['3', 'things', 'parents', 'consider', 'going', 'back', 'work', 'work', 'series']"
1032,TED,6 ways to improve your relationship with money   the way we work  a ted series,10/02/2020,130555,2536,65,Feb,257,"['6', 'ways', 'improve', 'relationship', 'money', 'work', 'series']"
1033,TED,the secret to giving great feedback   the way we work  a ted series,10/02/2020,942562,11239,141,Feb,302,"['secret', 'giving', 'great', 'feedback', 'work', 'series']"
1034,TED,how to embrace emotions at work   the way we work  a ted series,10/02/2020,193834,2980,74,Feb,276,"['embrace', 'emotions', 'work', 'work', 'series']"
1035,TED,how burnout makes us less creative   the way we work  a ted series,10/02/2020,138089,3664,85,Feb,305,"['burnout', 'makes', 'less', 'creative', 'work', 'series']"
1036,TED,how to make faster decisions   the way we work  a ted series,10/02/2020,438938,10139,179,Feb,308,"['faster', 'decisions', 'work', 'series']"
1037,TED,are indoor vertical farms the future of agriculture    stuart oda,07/02/2020,451083,13377,641,Feb,598,"['indoor', 'vertical', 'farms', 'future', 'agriculture', 'stuart', 'oda']"
1038,TED,why are drug prices so high  investigating the outdated us patent system   priti krishtel,06/02/2020,89411,2556,223,Feb,755,"['drug', 'prices', 'high', 'investigating', 'outdated', 'patent', 'system', 'priti', 'krishtel']"
1039,TED,why can t we talk about periods    jen gunter,05/02/2020,142158,5472,709,Feb,703,"['periods', 'jen', 'gunter']"
1040,TED,a path to security for the world s deadliest countries   rachel kleinfeld,04/02/2020,66442,1716,206,Feb,941,"['path', 'security', 'world', 'deadliest', 'countries', 'rachel', 'kleinfeld']"
1041,TED,the power of the afro pick   small thing big idea  a ted series,04/02/2020,154600,5275,296,Feb,228,"['power', 'afro', 'pick', 'small', 'thing', 'big', 'idea', 'series']"
1042,TED,how guest worker visas could transform the us immigration system   david j  bier,03/02/2020,43008,664,155,Feb,657,"['guest', 'worker', 'visas', 'transform', 'immigration', 'system', 'david', 'bier']"
1043,TED,why  biofabrication  is the next industrial revolution   suzanne lee,31/01/2020,220359,8040,531,Jan,741,"['biofabrication', 'industrial', 'revolution', 'suzanne', 'lee']"
1044,TED,climate change will displace millions  here s how we prepare   colette pichon battle,30/01/2020,134531,3214,828,Jan,768,"['climate', 'change', 'displace', 'millions', 'prepare', 'colette', 'pichon', 'battle']"
1045,TED,a swarm of mini drones makes     magic    marco tempest,29/01/2020,284146,7537,441,Jan,201,"['swarm', 'mini', 'drones', 'makes', 'magic', 'marco', 'tempest']"
1046,TED,what a digital government looks like   anna piperal,28/01/2020,152107,4177,418,Jan,834,"['digital', 'government', 'looks', 'like', 'anna', 'piperal']"
1047,TED,why books are here to stay   small thing big idea  a ted series,28/01/2020,307982,10691,343,Jan,212,"['books', 'stay', 'small', 'thing', 'big', 'idea', 'series']"
1048,TED,the secret weapon that let dinosaurs take over the planet   emma schachner,28/01/2020,117919,3064,239,Jan,613,"['secret', 'weapon', 'let', 'dinosaurs', 'take', 'planet', 'emma', 'schachner']"
1049,TED,the urgent case for antibiotic free animals   leon marchal,27/01/2020,52124,1361,222,Jan,660,"['urgent', 'case', 'antibiotic', 'free', 'animals', 'leon', 'marchal']"
1050,TED,the search for dark matter    and what we ve found so far   risa wechsler,27/01/2020,537807,10714,1542,Jan,944,"['search', 'dark', 'matter', 'found', 'far', 'risa', 'wechsler']"
1051,TED,the  opportunity gap  in us public education    and how to close it   anindya kundu,23/01/2020,108883,2100,215,Jan,480,"['opportunity', 'gap', 'public', 'education', 'close', 'anindya', 'kundu']"
1052,TED,why winning doesn t always equal success   valorie kondos field,23/01/2020,190651,5703,182,Jan,950,"['winning', 'always', 'equal', 'success', 'valorie', 'kondos', 'field']"
1053,TED,the past  present and future of nicotine addiction   mitch zeller,22/01/2020,115218,2916,497,Jan,1051,"['past', 'present', 'future', 'nicotine', 'addiction', 'mitch', 'zeller']"
1054,TED,cara e  yar khan  the beautiful balance between courage and fear   ted,22/01/2020,193083,4574,151,Jan,596,"['cara', 'yar', 'khan', 'beautiful', 'balance', 'courage', 'fear']"
1055,TED,why 1 5 billion people eat with chopsticks   small thing big idea  a ted series,21/01/2020,1490031,41332,2611,Jan,207,"['1', '5', 'billion', 'people', 'eat', 'chopsticks', 'small', 'thing', 'big', 'idea', 'series']"
1056,TED,how to turn off work thoughts during your free time   guy winch,21/01/2020,283908,8854,276,Jan,750,"['turn', 'work', 'thoughts', 'free', 'time', 'guy', 'winch']"
1057,TED,how civilization could destroy itself    and 4 ways we could prevent it   nick bostrom,17/01/2020,144548,2700,467,Jan,1270,"['civilization', 'destroy', '4', 'ways', 'prevent', 'nick', 'bostrom']"
1058,TED,what we re getting wrong in the fight to end hunger   jasmine crowe,17/01/2020,73642,2081,202,Jan,732,"['getting', 'wrong', 'fight', 'end', 'hunger', 'jasmine', 'crowe']"
1059,TED,how we can protect truth in the age of misinformation   sinan aral,16/01/2020,184337,4510,420,Jan,904,"['protect', 'truth', 'age', 'misinformation', 'sinan', 'aral']"
1060,TED,your body was forged in the spectacular death of stars   enrico ramirez ruiz,15/01/2020,58876,1503,125,Jan,935,"['body', 'forged', 'spectacular', 'death', 'stars', 'enrico', 'ramirez', 'ruiz']"
1061,TED,how the gut microbes you re born with affect your lifelong health   henna maria uusitupa,14/01/2020,105656,2643,169,Jan,641,"['gut', 'microbes', 'born', 'affect', 'lifelong', 'health', 'henna', 'maria', 'uusitupa']"
1062,TED,the function and fashion of eyeglasses   small thing big idea  a ted series,14/01/2020,132825,2946,83,Jan,209,"['function', 'fashion', 'eyeglasses', 'small', 'thing', 'big', 'idea', 'series']"
1063,TED,why lakes and rivers should have the same rights as humans   kelsey leonard,14/01/2020,48134,1210,421,Jan,802,"['lakes', 'rivers', 'rights', 'humans', 'kelsey', 'leonard']"
1064,TED,to help solve global problems  look to developing countries   bright simons,13/01/2020,52481,1427,107,Jan,589,"['help', 'solve', 'global', 'problems', 'look', 'developing', 'countries', 'bright', 'simons']"
1065,TED,what is economic value  and who creates it    mariana mazzucato,10/01/2020,244199,5929,361,Jan,1136,"['economic', 'value', 'creates', 'mariana', 'mazzucato']"
1066,TED,the paradox of efficiency   edward tenner,09/01/2020,249996,4492,220,Jan,834,"['paradox', 'efficiency', 'edward', 'tenner']"
1067,TED,the unforeseen consequences of a fast paced world   kathryn bouskill,08/01/2020,148557,3444,317,Jan,567,"['unforeseen', 'consequences', 'fast', 'paced', 'world', 'kathryn', 'bouskill']"
1068,TED,how the compass unlocked the world   small thing big idea  a ted series,08/01/2020,190337,3331,124,Jan,201,"['compass', 'unlocked', 'world', 'small', 'thing', 'big', 'idea', 'series']"
1069,TED,the profound power of an authentic apology   eve ensler,07/01/2020,106244,3819,203,Jan,504,"['profound', 'power', 'authentic', 'apology', 'eve', 'ensler']"
1070,TED,the problem of light pollution    and 5 ridiculously easy ways to fix it   kelsey johnson,06/01/2020,82303,2836,258,Jan,809,"['problem', 'light', 'pollution', '5', 'ridiculously', 'easy', 'ways', 'fix', 'kelsey', 'johnson']"
1071,TED,a video game that helps us understand loneliness   cornelia geppert,06/01/2020,176310,7872,392,Jan,763,"['video', 'game', 'helps', 'understand', 'loneliness', 'cornelia', 'geppert']"
1072,TED,3 ways to be a more effective fundraiser   kara logan berlin,03/01/2020,88055,2114,69,Jan,969,"['3', 'ways', 'effective', 'fundraiser', 'kara', 'logan', 'berlin']"
1073,TED,how i use art to tackle plastic pollution in our oceans   alejandro durán,02/01/2020,76812,2332,111,Jan,438,"['art', 'tackle', 'plastic', 'pollution', 'oceans', 'alejandro', 'durán']"
1074,TED,how i m using biological data to tell better stories    and spark social change   heidi boisvert,02/01/2020,51405,1213,167,Jan,470,"['using', 'biological', 'data', 'tell', 'better', 'stories', 'spark', 'social', 'change', 'heidi', 'boisvert']"
1075,TED,dangerous times call for dangerous women   pat mitchell,02/01/2020,31246,657,64,Jan,1035,"['dangerous', 'times', 'call', 'dangerous', 'women', 'pat', 'mitchell']"
1076,TED,the incredible chemistry powering your smartphone   cathy mulzer,23/12/2019,144556,2752,229,Dec,817,"['incredible', 'chemistry', 'powering', 'smartphone', 'cathy', 'mulzer']"
1077,TED,how you can use impostor syndrome to your benefit   mike cannon brookes,21/12/2019,575936,20691,661,Dec,823,"['impostor', 'syndrome', 'benefit', 'mike', 'cannon', 'brookes']"
1078,TED,the search for our solar system s ninth planet   mike brown,21/12/2019,404401,10980,1342,Dec,833,"['search', 'solar', 'system', 'ninth', 'planet', 'mike', 'brown']"
1079,TED,how to save a language from extinction   daniel bögre udell,19/12/2019,73073,1866,218,Dec,407,"['save', 'language', 'extinction', 'daniel', 'bögre', 'udell']"
1080,TED,a creative solution for the water crisis in flint  michigan   latoya ruby frazier,19/12/2019,46115,1253,165,Dec,710,"['creative', 'solution', 'water', 'crisis', 'flint', 'michigan', 'latoya', 'ruby', 'frazier']"
1081,TED,why it s so hard to make healthy decisions   david asch,19/12/2019,389124,9271,201,Dec,1014,"['hard', 'healthy', 'decisions', 'david', 'asch']"
1082,TED,3 questions we should ask about nuclear weapons   emma belcher,18/12/2019,74346,1361,241,Dec,783,"['3', 'questions', 'ask', 'nuclear', 'weapons', 'emma', 'belcher']"
1083,TED,how to change your behavior for the better   dan ariely,17/12/2019,540234,12029,333,Dec,914,"['change', 'behavior', 'better', 'dan', 'ariely']"
